[{"DOI": "10.48550/arXiv.2107.00541", "URL": "https://arxiv.org/abs/2107.00541", "abstract": "Goal-conditioned reinforcement learning endows an agent with a large variety of skills, but it often struggles to solve tasks that require more temporally extended reasoning. In this work, we propose to incorporate imagined subgoals into policy learning to facilitate learning of complex tasks. Imagined subgoals are predicted by a separate high-level policy, which is trained simultaneously with the policy and its critic. This high-level policy predicts intermediate states halfway to the goal using the value function as a reachability metric. We don\u2019t require the policy to reach these subgoals explicitly. Instead, we use them to define a prior policy, and incorporate this prior into a KL-constrained policy iteration scheme to speed up and regularize learning. Imagined subgoals are used during policy learning, but not during test time, where we only apply the learned policy. We evaluate our approach on complex robotic navigation and manipulation tasks and show that it outperforms existing methods by a large margin.", "accessed": {"date-parts": [[2025, 6, 14]]}, "author": [{"family": "Chane-Sane", "given": "Elliot"}, {"family": "Schmid", "given": "Cordelia"}, {"family": "Laptev", "given": "Ivan"}], "id": "chane-saneGoalConditionedReinforcementLearning2021a", "issued": {"date-parts": [[2021, 7]]}, "keyword": "Computer Science - Machine Learning,Computer Science - Robotics", "number": "arXiv:2107.00541", "publisher": "arXiv", "title": "Goal-Conditioned Reinforcement Learning with Imagined Subgoals", "type": "", "original_bibtex": "@misc{chane-saneGoalConditionedReinforcementLearning2021a,\n title = {Goal-{{Conditioned Reinforcement Learning}} with {{Imagined Subgoals}}},\n author = {{Chane-Sane}, Elliot and Schmid, Cordelia and Laptev, Ivan},\n year = {2021},\n doi = {10.48550/arXiv.2107.00541},\n urldate = {2025-06-14},\n number = {arXiv:2107.00541},\n publisher = {arXiv},\n file = {/home/kellen/Zotero/storage/52GUMEKN/Chane-Sane et al. - 2021 - Goal-Conditioned Reinforcement Learning with Imagined Subgoals.pdf;/home/kellen/Zotero/storage/6UY9VF4F/2107.html},\n keywords = {Computer Science - Machine Learning,Computer Science - Robotics},\n archiveprefix = {arXiv},\n abstract = {Goal-conditioned reinforcement learning endows an agent with a large variety of skills, but it often struggles to solve tasks that require more temporally extended reasoning. In this work, we propose to incorporate imagined subgoals into policy learning to facilitate learning of complex tasks. Imagined subgoals are predicted by a separate high-level policy, which is trained simultaneously with the policy and its critic. This high-level policy predicts intermediate states halfway to the goal using the value function as a reachability metric. We don't require the policy to reach these subgoals explicitly. Instead, we use them to define a prior policy, and incorporate this prior into a KL-constrained policy iteration scheme to speed up and regularize learning. Imagined subgoals are used during policy learning, but not during test time, where we only apply the learned policy. We evaluate our approach on complex robotic navigation and manipulation tasks and show that it outperforms existing methods by a large margin.},\n primaryclass = {cs},\n eprint = {2107.00541},\n month = {July}\n}\n"}]