[{"DOI": "10.48550/arXiv.2502.01591", "URL": "https://arxiv.org/abs/2502.01591", "abstract": "We present an approach to model-based RL that achieves a new state of the art performance on the challenging Craftax-classic benchmark, an open-world 2D survival game that requires agents to exhibit a wide range of general abilities \u2013 such as strong generalization, deep exploration, and long-term reasoning. With a series of careful design choices aimed at improving sample efficiency, our MBRL algorithm achieves a reward of 67.4% after only 1M environment steps, significantly outperforming DreamerV3, which achieves 53.2%, and, for the first time, exceeds human performance of 65.0%. Our method starts by constructing a SOTA model-free baseline, using a novel policy architecture that combines CNNs and RNNs. We then add three improvements to the standard MBRL setup: (a) \"Dyna with warmup\", which trains the policy on real and imaginary data, (b) \"nearest neighbor tokenizer\" on image patches, which improves the scheme to create the transformer world model (TWM) inputs, and (c) \"block teacher forcing\", which allows the TWM to reason jointly about the future tokens of the next timestep.", "accessed": {"date-parts": [[2025, 2, 16]]}, "author": [{"family": "Dedieu", "given": "Antoine"}, {"family": "Ortiz", "given": "Joseph"}, {"family": "Lou", "given": "Xinghua"}, {"family": "Wendelken", "given": "Carter"}, {"family": "Lehrach", "given": "Wolfgang"}, {"family": "Guntupalli", "given": "J. Swaroop"}, {"family": "Lazaro-Gredilla", "given": "Miguel"}, {"family": "Murphy", "given": "Kevin Patrick"}], "id": "dedieuImprovingTransformerWorld2025", "issued": {"date-parts": [[2025, 2]]}, "keyword": "Computer Science - Artificial Intelligence,Computer Science - Machine Learning", "language": "en-US", "number": "arXiv:2502.01591", "publisher": "arXiv", "title": "Improving Transformer World Models for Data-Efficient RL", "type": "", "original_bibtex": "@misc{dedieuImprovingTransformerWorld2025,\n title = {Improving {{Transformer World Models}} for {{Data-Efficient RL}}},\n author = {Dedieu, Antoine and Ortiz, Joseph and Lou, Xinghua and Wendelken, Carter and Lehrach, Wolfgang and Guntupalli, J. Swaroop and {Lazaro-Gredilla}, Miguel and Murphy, Kevin Patrick},\n year = {2025},\n doi = {10.48550/arXiv.2502.01591},\n urldate = {2025-02-16},\n number = {arXiv:2502.01591},\n publisher = {arXiv},\n file = {/home/kellen/Zotero/storage/ICQPUZXS/Dedieu et al. - 2025 - Improving Transformer World Models for Data-Efficient RL.pdf},\n keywords = {Computer Science - Artificial Intelligence,Computer Science - Machine Learning},\n langid = {english},\n archiveprefix = {arXiv},\n abstract = {We present an approach to model-based RL that achieves a new state of the art performance on the challenging Craftax-classic benchmark, an open-world 2D survival game that requires agents to exhibit a wide range of general abilities -- such as strong generalization, deep exploration, and long-term reasoning. With a series of careful design choices aimed at improving sample efficiency, our MBRL algorithm achieves a reward of 67.4\\% after only 1M environment steps, significantly outperforming DreamerV3, which achieves 53.2\\%, and, for the first time, exceeds human performance of 65.0\\%. Our method starts by constructing a SOTA model-free baseline, using a novel policy architecture that combines CNNs and RNNs. We then add three improvements to the standard MBRL setup: (a) \"Dyna with warmup\", which trains the policy on real and imaginary data, (b) \"nearest neighbor tokenizer\" on image patches, which improves the scheme to create the transformer world model (TWM) inputs, and (c) \"block teacher forcing\", which allows the TWM to reason jointly about the future tokens of the next timestep.},\n primaryclass = {cs},\n eprint = {2502.01591},\n month = {February}\n}\n"}]