[{"DOI": "10.48550/arXiv.2104.06272", "URL": "https://arxiv.org/abs/2104.06272", "abstract": "Supporting state-of-the-art AI research requires balancing rapid prototyping, ease of use, and quick iteration, with the ability to deploy experiments at a scale traditionally associated with production systems.Deep learning frameworks such as TensorFlow, PyTorch and JAX allow users to transparently make use of accelerators, such as TPUs and GPUs, to offload the more computationally intensive parts of training and inference in modern deep learning systems. Popular training pipelines that use these frameworks for deep learning typically focus on (un-)supervised learning. How to best train reinforcement learning (RL) agents at scale is still an active research area. In this report we argue that TPUs are particularly well suited for training RL agents in a scalable, efficient and reproducible way. Specifically we describe two architectures designed to make the best use of the resources available on a TPU Pod (a special configuration in a Google data center that features multiple TPU devices connected to each other by extremely low latency communication channels).", "accessed": {"date-parts": [[2025, 2, 11]]}, "author": [{"family": "Hessel", "given": "Matteo"}, {"family": "Kroiss", "given": "Manuel"}, {"family": "Clark", "given": "Aidan"}, {"family": "Kemaev", "given": "Iurii"}, {"family": "Quan", "given": "John"}, {"family": "Keck", "given": "Thomas"}, {"family": "Viola", "given": "Fabio"}, {"dropping-particle": "van", "family": "Hasselt", "given": "Hado"}], "id": "hesselPodracerArchitecturesScalable2021", "issued": {"date-parts": [[2021, 4]]}, "keyword": "Computer Science - Machine Learning", "language": "en-US", "number": "arXiv:2104.06272", "publisher": "arXiv", "title": "Podracer architectures for scalable Reinforcement Learning", "type": "", "original_bibtex": "@misc{hesselPodracerArchitecturesScalable2021,\n title = {Podracer Architectures for Scalable {{Reinforcement Learning}}},\n author = {Hessel, Matteo and Kroiss, Manuel and Clark, Aidan and Kemaev, Iurii and Quan, John and Keck, Thomas and Viola, Fabio and van Hasselt, Hado},\n year = {2021},\n doi = {10.48550/arXiv.2104.06272},\n urldate = {2025-02-11},\n number = {arXiv:2104.06272},\n publisher = {arXiv},\n file = {/home/kellen/Zotero/storage/YM29JDFM/Hessel et al. - 2021 - Podracer architectures for scalable Reinforcement Learning.pdf},\n keywords = {Computer Science - Machine Learning},\n langid = {english},\n archiveprefix = {arXiv},\n abstract = {Supporting state-of-the-art AI research requires balancing rapid prototyping, ease of use, and quick iteration, with the ability to deploy experiments at a scale traditionally associated with production systems.Deep learning frameworks such as TensorFlow, PyTorch and JAX allow users to transparently make use of accelerators, such as TPUs and GPUs, to offload the more computationally intensive parts of training and inference in modern deep learning systems. Popular training pipelines that use these frameworks for deep learning typically focus on (un-)supervised learning. How to best train reinforcement learning (RL) agents at scale is still an active research area. In this report we argue that TPUs are particularly well suited for training RL agents in a scalable, efficient and reproducible way. Specifically we describe two architectures designed to make the best use of the resources available on a TPU Pod (a special configuration in a Google data center that features multiple TPU devices connected to each other by extremely low latency communication channels).},\n primaryclass = {cs},\n eprint = {2104.06272},\n month = {April}\n}\n"}]