[{"DOI": "10.48550/arXiv.2104.06303", "URL": "https://arxiv.org/abs/2104.06303", "abstract": "Many important real-world problems have action spaces that are high-dimensional, continuous or both, making full enumeration of all possible actions infeasible. Instead, only small subsets of actions can be sampled for the purpose of policy evaluation and improvement. In this paper, we propose a general framework to reason in a principled way about policy evaluation and improvement over such sampled action subsets. This sample-based policy iteration framework can in principle be applied to any reinforcement learning algorithm based upon policy iteration. Concretely, we propose Sampled MuZero, an extension of the MuZero algorithm that is able to learn in domains with arbitrarily complex action spaces by planning over sampled actions. We demonstrate this approach on the classical board game of Go and on two continuous control benchmark domains: DeepMind Control Suite and Real-World RL Suite.", "accessed": {"date-parts": [[2025, 3, 31]]}, "author": [{"family": "Hubert", "given": "Thomas"}, {"family": "Schrittwieser", "given": "Julian"}, {"family": "Antonoglou", "given": "Ioannis"}, {"family": "Barekatain", "given": "Mohammadamin"}, {"family": "Schmitt", "given": "Simon"}, {"family": "Silver", "given": "David"}], "id": "hubertLearningPlanningComplex2021", "issued": {"date-parts": [[2021, 4]]}, "keyword": "Computer Science - Machine Learning", "language": "en-US", "number": "arXiv:2104.06303", "publisher": "arXiv", "title": "Learning and Planning in Complex Action Spaces", "type": "", "original_bibtex": "@misc{hubertLearningPlanningComplex2021,\n title = {Learning and {{Planning}} in {{Complex Action Spaces}}},\n author = {Hubert, Thomas and Schrittwieser, Julian and Antonoglou, Ioannis and Barekatain, Mohammadamin and Schmitt, Simon and Silver, David},\n year = {2021},\n doi = {10.48550/arXiv.2104.06303},\n urldate = {2025-03-31},\n number = {arXiv:2104.06303},\n publisher = {arXiv},\n file = {/home/kellen/Zotero/storage/AWL8Y6DZ/Hubert et al. - 2021 - Learning and Planning in Complex Action Spaces.pdf},\n keywords = {Computer Science - Machine Learning},\n langid = {english},\n archiveprefix = {arXiv},\n abstract = {Many important real-world problems have action spaces that are high-dimensional, continuous or both, making full enumeration of all possible actions infeasible. Instead, only small subsets of actions can be sampled for the purpose of policy evaluation and improvement. In this paper, we propose a general framework to reason in a principled way about policy evaluation and improvement over such sampled action subsets. This sample-based policy iteration framework can in principle be applied to any reinforcement learning algorithm based upon policy iteration. Concretely, we propose Sampled MuZero, an extension of the MuZero algorithm that is able to learn in domains with arbitrarily complex action spaces by planning over sampled actions. We demonstrate this approach on the classical board game of Go and on two continuous control benchmark domains: DeepMind Control Suite and Real-World RL Suite.},\n primaryclass = {cs},\n eprint = {2104.06303},\n month = {April}\n}\n"}]