[{"DOI": "10.48550/arXiv.1610.09512", "URL": "https://arxiv.org/abs/1610.09512", "abstract": "This paper studies systematic exploration for reinforcement learning with rich observations and function approximation. We introduce a new model called contextual decision processes, that unifies and generalizes most prior settings. Our first contribution is a complexity measure, the Bellman rank , that we show enables tractable learning of near-optimal behavior in these processes and is naturally small for many well-studied reinforcement learning settings. Our second contribution is a new reinforcement learning algorithm that engages in systematic exploration to learn contextual decision processes with low Bellman rank. Our algorithm provably learns near-optimal behavior with a number of samples that is polynomial in all relevant parameters but independent of the number of unique observations. The approach uses Bellman error minimization with optimistic exploration and provides new insights into efficient exploration for reinforcement learning with function approximation.", "accessed": {"date-parts": [[2025, 2, 5]]}, "author": [{"family": "Jiang", "given": "Nan"}, {"family": "Krishnamurthy", "given": "Akshay"}, {"family": "Agarwal", "given": "Alekh"}, {"family": "Langford", "given": "John"}, {"family": "Schapire", "given": "Robert E."}], "id": "jiangContextualDecisionProcesses2016", "issued": {"date-parts": [[2016, 12]]}, "keyword": "Computer Science - Machine Learning,Statistics - Machine Learning", "language": "en-US", "number": "arXiv:1610.09512", "publisher": "arXiv", "title": "Contextual Decision Processes with Low Bellman Rank are PAC-Learnable", "type": "", "original_bibtex": "@misc{jiangContextualDecisionProcesses2016,\n title = {Contextual {{Decision Processes}} with {{Low Bellman Rank}} Are {{PAC-Learnable}}},\n author = {Jiang, Nan and Krishnamurthy, Akshay and Agarwal, Alekh and Langford, John and Schapire, Robert E.},\n year = {2016},\n doi = {10.48550/arXiv.1610.09512},\n urldate = {2025-02-05},\n number = {arXiv:1610.09512},\n publisher = {arXiv},\n file = {/home/kellen/Zotero/storage/RCXBGU3P/Jiang et al. - 2016 - Contextual Decision Processes with Low Bellman Rank are PAC-Learnable.pdf},\n keywords = {Computer Science - Machine Learning,Statistics - Machine Learning},\n langid = {english},\n archiveprefix = {arXiv},\n abstract = {This paper studies systematic exploration for reinforcement learning with rich observations and function approximation. We introduce a new model called contextual decision processes, that unifies and generalizes most prior settings. Our first contribution is a complexity measure, the Bellman rank , that we show enables tractable learning of near-optimal behavior in these processes and is naturally small for many well-studied reinforcement learning settings. Our second contribution is a new reinforcement learning algorithm that engages in systematic exploration to learn contextual decision processes with low Bellman rank. Our algorithm provably learns near-optimal behavior with a number of samples that is polynomial in all relevant parameters but independent of the number of unique observations. The approach uses Bellman error minimization with optimistic exploration and provides new insights into efficient exploration for reinforcement learning with function approximation.},\n primaryclass = {cs},\n eprint = {1610.09512},\n month = {December}\n}\n"}]