[{"DOI": "10.1609/icaps.v21i1.13452", "ISSN": "2334-0843", "abstract": "Research in efficient methods for solving infinite-horizon MDPs has so far concentrated primarily on discounted MDPs and the more general stochastic shortest path problems (SSPs). These are MDPs with 1) an optimal value function V* that is the unique solution of Bellman equation and 2) optimal policies that are the greedy policies w.r.t. V*. This paper&rsquo;s main contribution is the description of a new class of MDPs, that have well-defined optimal solutions that do not comply with either 1 or 2 above. We call our new class Generalized Stochastic Shortest Path (GSSP) problems. GSSP allows more general reward structure than SSP and subsumes several established MDP types including SSP, positive-bounded, negative, and discounted-reward models. While existing efficient heuristic search algorithms like LAO* and LRTDP are not guaranteed to converge to the optimal value function for GSSPs, we present a new heuristic-search-based family of algorithms, FRET (Find, Revise, Eliminate Traps). A preliminary empirical evaluation shows that FRET solves GSSPs much more efficiently than Value Iteration.", "accessed": {"date-parts": [[2025, 3, 22]]}, "author": [{"family": "Kolobov", "given": "Andrey"}, {"family": "Mausam", "given": "Mausam"}, {"family": "Weld", "given": "Daniel"}, {"family": "Geffner", "given": "Hector"}], "container-title": "Proceedings of the International Conference on Automated Planning and Scheduling", "id": "kolobovHeuristicSearchGeneralized2011", "issued": {"date-parts": [[2011, 3]]}, "language": "en-US", "page": "130-137", "title": "Heuristic Search for Generalized Stochastic Shortest Path MDPs", "type": "article-journal", "volume": "21", "original_bibtex": "@article{kolobovHeuristicSearchGeneralized2011,\n title = {Heuristic {{Search}} for {{Generalized Stochastic Shortest Path MDPs}}},\n author = {Kolobov, Andrey and Mausam, Mausam and Weld, Daniel and Geffner, Hector},\n year = {2011},\n doi = {10.1609/icaps.v21i1.13452},\n urldate = {2025-03-22},\n journal = {Proceedings of the International Conference on Automated Planning and Scheduling},\n volume = {21},\n pages = {130--137},\n file = {/home/kellen/Zotero/storage/Q77EPBX6/Kolobov et al. - 2011 - Heuristic Search for Generalized Stochastic Shortest Path MDPs.pdf},\n langid = {english},\n copyright = {Copyright (c) 2021 Proceedings of the International Conference on Automated Planning and Scheduling},\n abstract = {Research in efficient methods for solving infinite-horizon MDPs has so far concentrated primarily on discounted MDPs and the more general stochastic shortest path problems (SSPs). These are MDPs with 1) an optimal value function V* that is the unique solution of Bellman equation and 2) optimal policies that are the greedy policies w.r.t. V*. This paper\\&rsquo;s main contribution is the description of a new class of MDPs, that have well-defined optimal solutions that do not comply with either 1 or 2 above. We call our new class Generalized Stochastic Shortest Path (GSSP) problems. GSSP allows more general reward structure than SSP and subsumes several established MDP types including SSP, positive-bounded, negative, and discounted-reward models. While existing efficient heuristic search algorithms like LAO* and LRTDP are not guaranteed to converge to the optimal value function for GSSPs, we present a new heuristic-search-based family of algorithms, FRET (Find, Revise, Eliminate Traps). A preliminary empirical evaluation shows that FRET solves GSSPs much more efficiently than Value Iteration.},\n issn = {2334-0843},\n month = {March}\n}\n"}]