[{"DOI": "10.1007/BF00115009", "ISSN": "0885-6125, 1573-0565", "abstract": "This article introduces a class of incremental learning procedures specialized for prediction\u2014that is, for using past experience with an incompletely known system to predict its future behavior. Whereas conventional prediction-learning methods assign credit by means of the difference between predicted and actual outcomes, the new methods assign credit by means of the difference between temporally successive predictions. Although such temporal-difference methods have been used in Samuel\u2019s checker player, Holland\u2019s bucket brigade, and the author\u2019s Adaptive Heuristic Critic, they have remained poorly understood. Here we prove their convergence and optimality for special cases and relate them to supervised-learning methods. For most real-world prediction problems, temporal-difference methods require less memory and less peak computation than conventional methods; and they produce more accurate predictions. We argue that most problems to which supervised learning is currently applied are really prediction problems of the sort to which temporaldifference methods can be applied to advantage.", "accessed": {"date-parts": [[2025, 2, 16]]}, "author": [{"family": "Sutton", "given": "Richard S."}], "container-title": "Machine Learning", "id": "suttonLearningPredictMethods1988", "issue": "1", "issued": {"date-parts": [[1988, 8]]}, "language": "en-US", "page": "9-44", "title": "Learning to predict by the methods of temporal differences", "type": "article-journal", "volume": "3", "original_bibtex": "@article{suttonLearningPredictMethods1988,\n title = {Learning to Predict by the Methods of Temporal Differences},\n author = {Sutton, Richard S.},\n year = {1988},\n doi = {10.1007/BF00115009},\n urldate = {2025-02-16},\n journal = {Machine Learning},\n volume = {3},\n number = {1},\n pages = {9--44},\n file = {/home/kellen/Zotero/storage/Q953STTS/Sutton - 1988 - Learning to predict by the methods of temporal differences.pdf},\n langid = {english},\n copyright = {http://www.springer.com/tdm},\n abstract = {This article introduces a class of incremental learning procedures specialized for prediction---that is, for using past experience with an incompletely known system to predict its future behavior. Whereas conventional prediction-learning methods assign credit by means of the difference between predicted and actual outcomes, the new methods assign credit by means of the difference between temporally successive predictions. Although such temporal-difference methods have been used in Samuel's checker player, Holland's bucket brigade, and the author's Adaptive Heuristic Critic, they have remained poorly understood. Here we prove their convergence and optimality for special cases and relate them to supervised-learning methods. For most real-world prediction problems, temporal-difference methods require less memory and less peak computation than conventional methods; and they produce more accurate predictions. We argue that most problems to which supervised learning is currently applied are really prediction problems of the sort to which temporaldifference methods can be applied to advantage.},\n issn = {0885-6125, 1573-0565},\n month = {August}\n}\n"}]