[{"ISSN": "2640-3498", "abstract": "We introduce FeUdal Networks (FuNs): a novel architecture for hierarchical reinforcement learning. Our approach is inspired by the feudal reinforcement learning proposal of Dayan and Hinton, and gains power and efficacy by decoupling end-to-end learning across multiple levels \u2013 allowing it to utilise different resolutions of time. Our framework employs a Manager module and a Worker module. The Manager operates at a slower time scale and sets abstract goals which are conveyed to and enacted by the Worker. The Worker generates primitive actions at every tick of the environment. The decoupled structure of FuN conveys several benefits \u2013 in addition to facilitating very long timescale credit assignment it also encourages the emergence of sub-policies associated with different goals set by the Manager. These properties allow FuN to dramatically outperform a strong baseline agent on tasks that involve long-term credit assignment or memorisation.", "accessed": {"date-parts": [[2025, 2, 10]]}, "author": [{"family": "Vezhnevets", "given": "Alexander Sasha"}, {"family": "Osindero", "given": "Simon"}, {"family": "Schaul", "given": "Tom"}, {"family": "Heess", "given": "Nicolas"}, {"family": "Jaderberg", "given": "Max"}, {"family": "Silver", "given": "David"}, {"family": "Kavukcuoglu", "given": "Koray"}], "container-title": "Proceedings of the 34th International Conference on Machine Learning", "id": "vezhnevetsFeUdalNetworksHierarchical2017", "issued": {"date-parts": [[2017, 7]]}, "language": "en-US", "page": "3540-3549", "publisher": "PMLR", "title": "FeUdal Networks for Hierarchical Reinforcement Learning", "type": "paper-conference", "original_bibtex": "@inproceedings{vezhnevetsFeUdalNetworksHierarchical2017,\n title = {{{FeUdal Networks}} for {{Hierarchical Reinforcement Learning}}},\n author = {Vezhnevets, Alexander Sasha and Osindero, Simon and Schaul, Tom and Heess, Nicolas and Jaderberg, Max and Silver, David and Kavukcuoglu, Koray},\n year = {2017},\n urldate = {2025-02-10},\n booktitle = {Proceedings of the 34th {{International Conference}} on {{Machine Learning}}},\n pages = {3540--3549},\n publisher = {PMLR},\n file = {/home/kellen/Zotero/storage/U76B4QZ8/Vezhnevets et al. - 2017 - FeUdal Networks for Hierarchical Reinforcement Learning.pdf},\n langid = {english},\n abstract = {We introduce FeUdal Networks (FuNs): a novel architecture for hierarchical reinforcement learning. Our approach is inspired by the feudal reinforcement learning proposal of Dayan and Hinton, and gains power and efficacy by decoupling end-to-end learning across multiple levels -- allowing it to utilise different resolutions of time. Our framework employs a Manager module and a Worker module. The Manager operates at a slower time scale and sets abstract goals which are conveyed to and enacted by the Worker. The Worker generates primitive actions at every tick of the environment. The decoupled structure of FuN conveys several benefits -- in addition to facilitating very long timescale credit assignment it also encourages the emergence of sub-policies associated with different goals set by the Manager. These properties allow FuN to dramatically outperform a strong baseline agent on tasks that involve long-term credit assignment or memorisation.},\n issn = {2640-3498},\n month = {July}\n}\n"}]